{
  "$schema": "http://json-schema.org/draft-07/schema#",
  "title": "Executive Dashboard Project Schema",
  "description": "JSON Schema for project data used by the Executive Dashboard. Defines required fields, optional fields, enums, constraints, and data types for project configuration.",
  "type": "object",
  "required": [
    "name",
    "milestones",
    "completionPercentage",
    "healthStatus",
    "workItems"
  ],
  "properties": {
    "name": {
      "type": "string",
      "minLength": 1,
      "maxLength": 200,
      "description": "Project name or codename. Required field. Must be between 1-200 characters. Example: 'Project Blue Sky' or 'Q2 Release Initiative'."
    },
    "description": {
      "type": ["string", "null"],
      "maxLength": 1000,
      "description": "Optional project description or summary. Provides context about project goals and scope. Recommended length 50-500 characters. Example: 'Core platform modernization and feature expansion for 2024-2025 fiscal year.'"
    },
    "startDate": {
      "type": ["string", "null"],
      "description": "Optional project start date in ISO 8601 format. Accepts both date-only (YYYY-MM-DD) or full datetime (YYYY-MM-DDTHH:mm:ssZ). Examples: '2024-01-15' or '2024-01-15T09:00:00Z'."
    },
    "targetEndDate": {
      "type": ["string", "null"],
      "description": "Optional project target completion date in ISO 8601 format. Accepts both date-only (YYYY-MM-DD) or full datetime (YYYY-MM-DDTHH:mm:ssZ). Examples: '2024-12-31' or '2024-12-31T23:59:59Z'."
    },
    "completionPercentage": {
      "type": "integer",
      "minimum": 0,
      "maximum": 100,
      "description": "Overall project completion percentage. Required field. Must be an integer between 0-100 inclusive. Represents the percentage of total work completed. Example: 45 means 45% complete."
    },
    "healthStatus": {
      "type": "string",
      "enum": [
        "OnTrack",
        "AtRisk",
        "Blocked"
      ],
      "description": "Project health status indicator. Required field. Valid values: 'OnTrack' (project proceeding as planned), 'AtRisk' (project at risk due to resource or timeline issues), 'Blocked' (project blocked by external dependency)."
    },
    "velocityThisMonth": {
      "type": ["integer", "null"],
      "minimum": 0,
      "description": "Optional velocity metric: count of work items completed in current month. Must be zero or positive integer. Example: 12 means 12 items shipped this month."
    },
    "milestones": {
      "type": "array",
      "minItems": 1,
      "description": "Array of project milestones. Required field. Must contain at least one milestone. Milestones represent key project deliverables or phases ordered by target date.",
      "items": {
        "type": "object",
        "required": [
          "name",
          "targetDate",
          "status"
        ],
        "properties": {
          "name": {
            "type": "string",
            "minLength": 1,
            "maxLength": 200,
            "description": "Milestone name or title. Required field. Example: 'Phase 1 Launch' or 'Q2 Release'."
          },
          "targetDate": {
            "type": "string",
            "description": "Milestone target completion date in ISO 8601 format. Required field. Accepts both date-only (YYYY-MM-DD) or full datetime (YYYY-MM-DDTHH:mm:ssZ). Examples: '2024-03-31' or '2024-03-31T23:59:59Z'."
          },
          "status": {
            "type": "string",
            "enum": [
              "Completed",
              "InProgress",
              "AtRisk",
              "Future"
            ],
            "description": "Milestone status. Required field. Valid values: 'Completed' (finished), 'InProgress' (currently active), 'AtRisk' (at risk of missing target date), 'Future' (not yet started)."
          },
          "description": {
            "type": ["string", "null"],
            "maxLength": 500,
            "description": "Optional milestone description providing context or deliverables. Example: 'Core feature rollout including API redesign and data migration.'"
          }
        },
        "additionalProperties": false
      }
    },
    "workItems": {
      "type": "array",
      "minItems": 0,
      "description": "Array of work items representing completed, in-progress, or carried over tasks. Required field (can be empty array). Work items are grouped by status for display.",
      "items": {
        "type": "object",
        "required": [
          "title",
          "status"
        ],
        "properties": {
          "title": {
            "type": "string",
            "minLength": 1,
            "maxLength": 200,
            "description": "Work item title or task name. Required field. Example: 'API Integration' or 'Database Migration'."
          },
          "description": {
            "type": ["string", "null"],
            "maxLength": 500,
            "description": "Optional work item description providing details about the task. Example: 'Connect to external data source and implement error handling.'"
          },
          "status": {
            "type": "string",
            "enum": [
              "Shipped",
              "InProgress",
              "CarriedOver"
            ],
            "description": "Work item status. Required field. Valid values: 'Shipped' (completed and deployed this month), 'InProgress' (currently being worked on), 'CarriedOver' (planned but not completed, carried to next period)."
          },
          "assignedTo": {
            "type": ["string", "null"],
            "maxLength": 100,
            "description": "Optional name or identifier of person/team assigned to this work item. Example: 'Team A' or 'John Smith'."
          }
        },
        "additionalProperties": false
      }
    }
  },
  "additionalProperties": false,
  "examples": [
    {
      "name": "Minimal Valid Project",
      "completionPercentage": 0,
      "healthStatus": "OnTrack",
      "milestones": [
        {
          "name": "Project Kickoff",
          "targetDate": "2024-02-01",
          "status": "Future"
        }
      ],
      "workItems": []
    },
    {
      "name": "Project Blue Sky",
      "description": "Comprehensive platform modernization initiative for enterprise clients",
      "startDate": "2024-01-01",
      "targetEndDate": "2024-12-31",
      "completionPercentage": 65,
      "healthStatus": "OnTrack",
      "velocityThisMonth": 12,
      "milestones": [
        {
          "name": "Phase 1: Foundation",
          "targetDate": "2024-03-31",
          "status": "Completed",
          "description": "Core infrastructure and API foundation"
        },
        {
          "name": "Phase 2: Features",
          "targetDate": "2024-06-30",
          "status": "InProgress",
          "description": "Primary feature set expansion"
        },
        {
          "name": "Phase 3: Optimization",
          "targetDate": "2024-09-30",
          "status": "AtRisk",
          "description": "Performance tuning and security hardening"
        },
        {
          "name": "Phase 4: Scale",
          "targetDate": "2024-12-31",
          "status": "Future",
          "description": "Enterprise deployment and scaling"
        }
      ],
      "workItems": [
        {
          "title": "User Authentication",
          "description": "OAuth 2.0 integration with Azure AD",
          "status": "Shipped",
          "assignedTo": "Team A"
        },
        {
          "title": "Data Migration",
          "description": "Move legacy data to new schema",
          "status": "Shipped",
          "assignedTo": "Team B"
        },
        {
          "title": "API Documentation",
          "description": "OpenAPI 3.0 spec and developer portal",
          "status": "Shipped",
          "assignedTo": "Team C"
        },
        {
          "title": "Real-time Sync",
          "description": "SignalR implementation for live updates",
          "status": "InProgress",
          "assignedTo": "Team A"
        },
        {
          "title": "Performance Benchmarking",
          "description": "Profiling and optimization of core endpoints",
          "status": "InProgress",
          "assignedTo": "Team B"
        },
        {
          "title": "Mobile App Integration",
          "description": "REST API endpoints for mobile clients",
          "status": "InProgress",
          "assignedTo": "Team D"
        },
        {
          "title": "Load Testing",
          "description": "Stress test infrastructure for 10K concurrent users",
          "status": "CarriedOver",
          "assignedTo": "Team C"
        },
        {
          "title": "Security Audit",
          "description": "Third-party penetration testing",
          "status": "CarriedOver",
          "assignedTo": "Team B"
        },
        {
          "title": "Compliance Certification",
          "description": "SOC 2 Type II audit preparation",
          "status": "CarriedOver",
          "assignedTo": "Team E"
        },
        {
          "title": "Disaster Recovery Plan",
          "description": "Document RTO/RPO and failover procedures",
          "status": "CarriedOver",
          "assignedTo": "Team A"
        },
        {
          "title": "Monitoring Dashboard",
          "description": "Grafana setup with key metrics and alerts",
          "status": "InProgress",
          "assignedTo": "Team C"
        },
        {
          "title": "Customer Onboarding",
          "description": "Self-service account provisioning system",
          "status": "InProgress",
          "assignedTo": "Team D"
        }
      ]
    }
  ]
}