{
  "name": "Executive Dashboard Project",
  "description": "Q1 2024 Executive Reporting Dashboard Initiative",
  "startDate": "2024-01-01",
  "targetEndDate": "2024-12-31",
  "completionPercentage": 45,
  "healthStatus": "OnTrack",
  "velocityThisMonth": 12,
  "milestones": [
    {
      "name": "Phase 1 - Foundation",
      "targetDate": "2024-03-31",
      "status": "Completed",
      "description": "Core infrastructure and data model setup"
    },
    {
      "name": "Phase 2 - UI Components",
      "targetDate": "2024-06-30",
      "status": "InProgress",
      "description": "Build Blazor components for dashboard visualization"
    },
    {
      "name": "Phase 3 - Launch",
      "targetDate": "2024-09-30",
      "status": "Future",
      "description": "Production deployment and optimization"
    }
  ],
  "workItems": [
    {
      "title": "DataProvider Service Implementation",
      "description": "Implement JSON reading and caching service layer with validation and error handling",
      "status": "Shipped",
      "assignedTo": "Engineering Team"
    },
    {
      "title": "Dashboard Layout Component",
      "description": "Create main dashboard Blazor component with CSS grid layout for responsive display",
      "status": "InProgress",
      "assignedTo": "UI Team"
    },
    {
      "title": "Milestone Timeline Visualization",
      "description": "Implement horizontal timeline with Chart.js for milestone status display",
      "status": "InProgress",
      "assignedTo": "Frontend Team"
    },
    {
      "title": "Project Metrics Display",
      "description": "Create KPI cards for project health indicators and completion percentage",
      "status": "InProgress",
      "assignedTo": "Design Team"
    },
    {
      "title": "Work Item Tracking",
      "description": "Implement three-column layout for shipped, in-progress, and carried-over items",
      "status": "InProgress",
      "assignedTo": "Frontend Team"
    },
    {
      "title": "Print/Screenshot Optimization",
      "description": "Optimize CSS for clean output on 1280x720 and 1920x1080 resolutions",
      "status": "CarriedOver",
      "assignedTo": "Design Team"
    },
    {
      "title": "Cross-Browser Testing",
      "description": "Verify dashboard renders correctly in Chrome and Edge",
      "status": "CarriedOver",
      "assignedTo": "QA Team"
    }
  ]
}