{
  "name": "Project Blue Sky",
  "description": "Comprehensive platform modernization initiative delivering next-generation infrastructure, expanded feature set, and enterprise-grade capabilities throughout 2024.",
  "startDate": "2024-01-01",
  "targetEndDate": "2024-12-31",
  "completionPercentage": 65,
  "healthStatus": "OnTrack",
  "velocityThisMonth": 12,
  "milestones": [
    {
      "name": "Core Infrastructure",
      "targetDate": "2024-03-15",
      "status": "Completed",
      "description": "Foundation deployment including cloud infrastructure, data pipelines, and core APIs."
    },
    {
      "name": "Feature Development",
      "targetDate": "2024-06-30",
      "status": "InProgress",
      "description": "Primary feature set rollout including user portal, reporting dashboards, and integrations."
    },
    {
      "name": "Performance Optimization",
      "targetDate": "2024-09-15",
      "status": "AtRisk",
      "description": "Performance tuning, database optimization, and caching layer implementation. At risk due to resource constraints."
    },
    {
      "name": "Security Hardening",
      "targetDate": "2024-11-30",
      "status": "Future",
      "description": "Comprehensive security audit, compliance certification, and penetration testing."
    },
    {
      "name": "Final Release Prep",
      "targetDate": "2024-12-31",
      "status": "Future",
      "description": "Production readiness validation, documentation finalization, and deployment preparation."
    }
  ],
  "workItems": [
    {
      "title": "User Authentication System",
      "description": "OAuth 2.0 and SAML integration with multi-factor authentication support for enterprise SSO",
      "status": "Shipped",
      "assignedTo": "Team A"
    },
    {
      "title": "Database Schema Migration",
      "description": "Migrate legacy monolithic database to microservices-compatible schema with zero downtime",
      "status": "Shipped",
      "assignedTo": "Team B"
    },
    {
      "title": "API Gateway Implementation",
      "description": "Kong API gateway deployment with rate limiting, authentication middleware, and request routing",
      "status": "Shipped",
      "assignedTo": "Team A"
    },
    {
      "title": "Reporting Module",
      "description": "Executive dashboard with real-time metrics, historical trend analysis, and custom report generation",
      "status": "Shipped",
      "assignedTo": "Team C"
    },
    {
      "title": "Client SDK Libraries",
      "description": "Python, JavaScript, and .NET client libraries for API consumption with built-in retry logic",
      "status": "Shipped",
      "assignedTo": "Team D"
    },
    {
      "title": "Real-time Notifications",
      "description": "WebSocket-based notification system with message queuing, persistence, and delivery guarantees",
      "status": "InProgress",
      "assignedTo": "Team A"
    },
    {
      "title": "Advanced Search Capabilities",
      "description": "Elasticsearch integration for full-text search across all data entities with faceted filtering",
      "status": "InProgress",
      "assignedTo": "Team B"
    },
    {
      "title": "Multi-tenancy Support",
      "description": "Data isolation layer, tenant-specific configuration management, and resource quota enforcement",
      "status": "InProgress",
      "assignedTo": "Team C"
    },
    {
      "title": "Analytics Pipeline",
      "description": "Event streaming via Apache Kafka, data aggregation, and analytics using ClickHouse",
      "status": "InProgress",
      "assignedTo": "Team E"
    },
    {
      "title": "Performance Benchmarking",
      "description": "Comprehensive load testing targeting 10K concurrent users, optimization of critical API endpoints",
      "status": "CarriedOver",
      "assignedTo": "Team B"
    },
    {
      "title": "Security Vulnerability Scanning",
      "description": "Automated security scanning with OWASP Top 10 coverage, remediation tracking, compliance reporting",
      "status": "CarriedOver",
      "assignedTo": "Team D"
    },
    {
      "title": "Disaster Recovery Plan",
      "description": "Document RTO/RPO targets, implement automated failover procedures, conduct disaster recovery drill",
      "status": "CarriedOver",
      "assignedTo": "Team E"
    }
  ]
}